speech_id,speech_url,speech_keyword,speech_duration,speech_date_start,speech_date_end,speech_agenda_item_title,sentence_speaker,sentence_speaker_status,sentence_speaker_party,sentence_speaker_faction,sentence_type,sentence_text,sentence_time_start,sentence_time_end,sentence_duration,sentence_sentiment_score,sentence_sentiment_positive_weight,sentence_sentiment_negative_weight,sentence_sentiment_neutral_weight
ID206907400,https://de.openparliament.tv/api/v1/media/DE-0200069083,Gesundheit,258,2022-11-23T17:36:40+01:00,2022-11-23T17:40:58+01:00,Einzelplan 23,Knut Gerschau,main-speaker,FDP,FDP,speech,Sehr geehrte Frau Präsidentin!,1.0,3.24,2.24,negative,0.019231420010328293,0.9692500233650208,0.011518583633005619
ID206907400,https://de.openparliament.tv/api/v1/media/DE-0200069083,Gesundheit,258,2022-11-23T17:36:40+01:00,2022-11-23T17:40:58+01:00,Einzelplan 23,Knut Gerschau,main-speaker,FDP,FDP,speech,Sehr geehrte Frau Ministerin!,3.24,8.12,4.879999999999999,negative,0.015041814185678959,0.9824443459510803,0.0025138340424746275
ID206907400,https://de.openparliament.tv/api/v1/media/DE-0200069083,Gesundheit,258,2022-11-23T17:36:40+01:00,2022-11-23T17:40:58+01:00,Einzelplan 23,Knut Gerschau,main-speaker,FDP,FDP,speech,Sehr geehrte Damen und Herren!,13.88,18.82,4.9399999999999995,negative,0.004207466263324022,0.9950461387634277,0.0007464670925401151
ID206907400,https://de.openparliament.tv/api/v1/media/DE-0200069083,Gesundheit,258,2022-11-23T17:36:40+01:00,2022-11-23T17:40:58+01:00,Einzelplan 23,Knut Gerschau,main-speaker,FDP,FDP,speech,"Herzlichen Glückwunsch zum Geburtstag: Der
                    achtmilliardste Mensch wurde letzte Woche geboren.",18.82,25.52,6.699999999999999,neutral,0.000755676650442183,0.0018989412346854806,0.9973453879356384
ID206907400,https://de.openparliament.tv/api/v1/media/DE-0200069083,Gesundheit,258,2022-11-23T17:36:40+01:00,2022-11-23T17:40:58+01:00,Einzelplan 23,Knut Gerschau,main-speaker,FDP,FDP,speech,Am Tag seiner Geburt wuchs die Weltbevölkerung um durchschnittlich 180 000 Menschen täglich.,25.52,33.3,7.779999999999998,neutral,3.008303337992402e-06,5.7031188589462545e-06,0.9999912977218628
ID206907400,https://de.openparliament.tv/api/v1/media/DE-0200069083,Gesundheit,258,2022-11-23T17:36:40+01:00,2022-11-23T17:40:58+01:00,Einzelplan 23,Knut Gerschau,main-speaker,FDP,FDP,speech,"Das sind täglich
                    180 000 neue Möglichkeiten, die Zukunft zu gestalten.",33.3,40.1,6.800000000000004,neutral,0.00011047151201637462,0.00020500479149632156,0.9996845722198486
ID206907400,https://de.openparliament.tv/api/v1/media/DE-0200069083,Gesundheit,258,2022-11-23T17:36:40+01:00,2022-11-23T17:40:58+01:00,Einzelplan 23,Knut Gerschau,main-speaker,FDP,FDP,speech,Besonders viele Menschen werden in Afrika südlich der Sahara geboren.,40.1,44.2,4.100000000000001,neutral,3.690888661367353e-06,4.701269517681794e-06,0.9999916553497314
ID206907400,https://de.openparliament.tv/api/v1/media/DE-0200069083,Gesundheit,258,2022-11-23T17:36:40+01:00,2022-11-23T17:40:58+01:00,Einzelplan 23,Knut Gerschau,main-speaker,FDP,FDP,speech,"Dort lebt die größte
                    Jugendgeneration aller Zeiten: 43 Prozent der Bevölkerung sind jünger als 15 Jahre.",44.2,52.62,8.419999999999995,neutral,3.3473049825261114e-06,5.158352905709762e-06,0.9999915361404419
ID206907400,https://de.openparliament.tv/api/v1/media/DE-0200069083,Gesundheit,258,2022-11-23T17:36:40+01:00,2022-11-23T17:40:58+01:00,Einzelplan 23,Knut Gerschau,main-speaker,FDP,FDP,speech,"In diesen jungen Menschen steckt ein riesiges Potenzial – wenn sie denn die
                    Chance bekommen, es zu entfalten.",52.62,60.7,8.080000000000005,neutral,3.9380201997119e-06,6.253888841456501e-06,0.9999898672103882
ID206907400,https://de.openparliament.tv/api/v1/media/DE-0200069083,Gesundheit,258,2022-11-23T17:36:40+01:00,2022-11-23T17:40:58+01:00,Einzelplan 23,Knut Gerschau,main-speaker,FDP,FDP,speech,"Damit die Jugendlichen ihr Leben verantwortungsvoll gestalten können, brauchen sie Gesundheit, Bildung, Aufklärung und Selbstbestimmung; denn wenn sie
                    aufgeklärt sind und einen Job haben, entscheiden sie sich in der Regel für die Anzahl der Kinder, die sie versorgen können.",60.7,78.48,17.78,neutral,4.198828264634358e-06,4.5753572521789465e-06,0.9999911785125732
ID206907400,https://de.openparliament.tv/api/v1/media/DE-0200069083,Gesundheit,258,2022-11-23T17:36:40+01:00,2022-11-23T17:40:58+01:00,Einzelplan 23,Knut Gerschau,main-speaker,FDP,FDP,speech,"Auch deshalb bin ich für eine
                    Stärkung von Frauen und Mädchen und ihrer Rechte.",78.48,84.56,6.079999999999998,neutral,0.0002620586601551622,0.0005174779216758907,0.9992204904556274
ID206907400,https://de.openparliament.tv/api/v1/media/DE-0200069083,Gesundheit,258,2022-11-23T17:36:40+01:00,2022-11-23T17:40:58+01:00,Einzelplan 23,Knut Gerschau,main-speaker,FDP,FDP,speech,"Wir brauchen eine Verbesserung der reproduktiven und sexuellen Rechte, bessere Müttergesundheit und umfassende
                    Aufklärung.",84.56,96.36,11.799999999999997,neutral,0.0007547767600044608,0.0014902546536177397,0.9977549910545349
ID206907400,https://de.openparliament.tv/api/v1/media/DE-0200069083,Gesundheit,258,2022-11-23T17:36:40+01:00,2022-11-23T17:40:58+01:00,Einzelplan 23,,,,,comment,"(Beifall bei der FDP, der SPD und dem BÜNDNIS 90/DIE GRÜNEN)",84.56,102.64,18.08,neutral,0.002617944497615099,0.007493812125176191,0.9898882508277893
ID206907400,https://de.openparliament.tv/api/v1/media/DE-0200069083,Gesundheit,258,2022-11-23T17:36:40+01:00,2022-11-23T17:40:58+01:00,Einzelplan 23,Knut Gerschau,main-speaker,FDP,FDP,speech,Das Thema Bevölkerungsdynamik hat nicht mit Bevormundung oder Neokolonialismus zu tun.,96.36,102.64,6.280000000000001,neutral,5.068215159553802e-06,1.1875923519255593e-05,0.9999830722808838
ID206907400,https://de.openparliament.tv/api/v1/media/DE-0200069083,Gesundheit,258,2022-11-23T17:36:40+01:00,2022-11-23T17:40:58+01:00,Einzelplan 23,Knut Gerschau,main-speaker,FDP,FDP,speech,"Es ist der Versuch, negative Konsequenzen für die betroffenen
                    Länder zu mindern.",102.64,108.5,5.859999999999999,neutral,4.008341420558281e-06,6.805224984418601e-06,0.9999891519546509
ID206907400,https://de.openparliament.tv/api/v1/media/DE-0200069083,Gesundheit,258,2022-11-23T17:36:40+01:00,2022-11-23T17:40:58+01:00,Einzelplan 23,Knut Gerschau,main-speaker,FDP,FDP,speech,Ein weiteres wichtiges Thema in diesem Zusammenhang ist die globale Ernährungssicherheit.,108.5,113.8,5.299999999999997,neutral,3.7208176308922702e-06,6.086555458750809e-06,0.9999902248382568
ID206907400,https://de.openparliament.tv/api/v1/media/DE-0200069083,Gesundheit,258,2022-11-23T17:36:40+01:00,2022-11-23T17:40:58+01:00,Einzelplan 23,Knut Gerschau,main-speaker,FDP,FDP,speech,"Der Haushalt macht deutlich: Es ist nicht hinnehmbar, dass
                    mehr als 800 Millionen Menschen auf der Welt Hunger leiden – deutlich mehr als noch vor einigen Jahren.",113.8,124.9,11.100000000000009,neutral,0.0003142039058730006,0.0009138968889601529,0.9987718462944031
ID206907400,https://de.openparliament.tv/api/v1/media/DE-0200069083,Gesundheit,258,2022-11-23T17:36:40+01:00,2022-11-23T17:40:58+01:00,Einzelplan 23,Knut Gerschau,main-speaker,FDP,FDP,speech,"Leider können wir den russischen Präsidenten nicht daran
                    hindern, in verbrecherischer Weise Hunger als globale Waffe einzusetzen.",124.9,134.46,9.560000000000002,neutral,0.001087010488845408,0.0030066892504692078,0.9959062337875366
ID206907400,https://de.openparliament.tv/api/v1/media/DE-0200069083,Gesundheit,258,2022-11-23T17:36:40+01:00,2022-11-23T17:40:58+01:00,Einzelplan 23,Knut Gerschau,main-speaker,FDP,FDP,speech,Aber wir können das entstandene Leid lindern.,134.46,138.8,4.340000000000003,neutral,8.137447730405256e-05,0.0002593739773146808,0.9996592998504639
ID206907400,https://de.openparliament.tv/api/v1/media/DE-0200069083,Gesundheit,258,2022-11-23T17:36:40+01:00,2022-11-23T17:40:58+01:00,Einzelplan 23,Knut Gerschau,main-speaker,FDP,FDP,speech,"Dazu stehen für das
                    Welternährungsprogramm 50 Millionen Euro mehr zur Verfügung als ursprünglich geplant.",138.8,145.6,6.799999999999983,neutral,3.455483692960115e-06,5.155322924110806e-06,0.9999914169311523
ID206907400,https://de.openparliament.tv/api/v1/media/DE-0200069083,Gesundheit,258,2022-11-23T17:36:40+01:00,2022-11-23T17:40:58+01:00,Einzelplan 23,Knut Gerschau,main-speaker,FDP,FDP,speech,"Für eine nachhaltige Umstellung von Agrar- und Ernährungssystemen werden
                    weitere 54 Millionen Euro bereitgestellt.",145.6,155.52,9.920000000000016,neutral,3.7291742955858354e-06,4.692301445174962e-06,0.9999915361404419
ID206907400,https://de.openparliament.tv/api/v1/media/DE-0200069083,Gesundheit,258,2022-11-23T17:36:40+01:00,2022-11-23T17:40:58+01:00,Einzelplan 23,,,,,comment,(Beifall bei der FDP sowie bei Abgeordneten der SPD und des BÜNDNISSES 90/DIE GRÜNEN),145.6,165.88,20.28,neutral,0.002075600903481245,0.005716989748179913,0.9922074675559998
ID206907400,https://de.openparliament.tv/api/v1/media/DE-0200069083,Gesundheit,258,2022-11-23T17:36:40+01:00,2022-11-23T17:40:58+01:00,Einzelplan 23,Knut Gerschau,main-speaker,FDP,FDP,speech,"Umfassende Gesundheitsvorsorge, dies wird auch ein beherrschendes Thema im Unterausschuss Globale Gesundheit sein.",155.52,165.88,10.359999999999985,neutral,3.6988028568885056e-06,5.540014626603806e-06,0.999990701675415
ID206907400,https://de.openparliament.tv/api/v1/media/DE-0200069083,Gesundheit,258,2022-11-23T17:36:40+01:00,2022-11-23T17:40:58+01:00,Einzelplan 23,Knut Gerschau,main-speaker,FDP,FDP,speech,"Dezentrale medizinische Versorgung
                    auch auf dem Land, Ausbildung von Ärzten und Krankenschwestern, Nutzung digitaler Möglichkeiten in der Telemedizin, Entwicklung von Impfstoffen auch im Globalen
                    Süden, vor allem in Afrika, Kampf gegen Polio, Malaria und künftige Epidemien – diese Themen werden wir auch in den nächsten Bundeshaushalten in den Blick
                    nehmen.",165.88,191.2,25.319999999999993,neutral,4.514346983341966e-06,4.662882929551415e-06,0.9999908208847046
ID206907400,https://de.openparliament.tv/api/v1/media/DE-0200069083,Gesundheit,258,2022-11-23T17:36:40+01:00,2022-11-23T17:40:58+01:00,Einzelplan 23,,,,,comment,(Beifall des Abg. Dr. Christoph Hoffmann [FDP]),165.88,199.68,33.80000000000001,neutral,0.00023698309087194502,0.0006323130219243467,0.9991306662559509
ID206907400,https://de.openparliament.tv/api/v1/media/DE-0200069083,Gesundheit,258,2022-11-23T17:36:40+01:00,2022-11-23T17:40:58+01:00,Einzelplan 23,Knut Gerschau,main-speaker,FDP,FDP,speech,"Zum Schluss weise ich darauf hin, dass private Investments mehr als bisher Bedeutung erlangen müssen.",191.2,199.68,8.480000000000018,neutral,2.8673841370618902e-05,6.883299647597596e-05,0.9999024868011475
ID206907400,https://de.openparliament.tv/api/v1/media/DE-0200069083,Gesundheit,258,2022-11-23T17:36:40+01:00,2022-11-23T17:40:58+01:00,Einzelplan 23,Knut Gerschau,main-speaker,FDP,FDP,speech,"Die Privatwirtschaft kann durch ihr Know-how und
                    ihre finanziellen Mittel die Wirkung staatlicher Hilfen enorm verstärken.",199.68,209.54,9.859999999999985,neutral,3.7020829495304497e-06,5.158897238288773e-06,0.9999911785125732
ID206907400,https://de.openparliament.tv/api/v1/media/DE-0200069083,Gesundheit,258,2022-11-23T17:36:40+01:00,2022-11-23T17:40:58+01:00,Einzelplan 23,Knut Gerschau,main-speaker,FDP,FDP,speech,"Investitionen lohnen sich zum Beispiel im Energiebereich, bei regenerativen Energien
                    und vor allem im Zukunftsbereich Wasserstoff.",209.54,219.78,10.240000000000009,neutral,5.02606690133689e-06,3.867318810080178e-06,0.9999910593032837
ID206907400,https://de.openparliament.tv/api/v1/media/DE-0200069083,Gesundheit,258,2022-11-23T17:36:40+01:00,2022-11-23T17:40:58+01:00,Einzelplan 23,Knut Gerschau,main-speaker,FDP,FDP,speech,"Und wir müssen junge Unternehmensgründungen mit innovativen Ideen stärker unterstützen; denn das hilft, eine
                    mittelständische wirtschaftliche Struktur in den Ländern aufzubauen.",219.78,232.22,12.439999999999998,neutral,4.271347734174924e-06,4.739241376228165e-06,0.9999909400939941
ID206907400,https://de.openparliament.tv/api/v1/media/DE-0200069083,Gesundheit,258,2022-11-23T17:36:40+01:00,2022-11-23T17:40:58+01:00,Einzelplan 23,Knut Gerschau,main-speaker,FDP,FDP,speech,"Der Haushalt 2023 hat die richtigen Weichen gestellt, wie die Kollegin Raffelhüschen schon eindrucksvoll ausgeführt hat.",232.22,241.12,8.900000000000006,neutral,1.2012830666208174e-05,2.6896137569565326e-05,0.9999611377716064
ID206907400,https://de.openparliament.tv/api/v1/media/DE-0200069083,Gesundheit,258,2022-11-23T17:36:40+01:00,2022-11-23T17:40:58+01:00,Einzelplan 23,Knut Gerschau,main-speaker,FDP,FDP,speech,"Wir werden diesen Weg mit
                    Nachdruck weiterverfolgen.",241.12,245.56,4.439999999999998,neutral,0.0006966912187635899,0.002585492329671979,0.9967177510261536
ID206907400,https://de.openparliament.tv/api/v1/media/DE-0200069083,Gesundheit,258,2022-11-23T17:36:40+01:00,2022-11-23T17:40:58+01:00,Einzelplan 23,Knut Gerschau,main-speaker,FDP,FDP,speech,Vielen Dank für Ihre Aufmerksamkeit.,245.56,253.68,8.120000000000005,positive,0.9964874982833862,0.0014208133798092604,0.0020916315261274576
ID206907400,https://de.openparliament.tv/api/v1/media/DE-0200069083,Gesundheit,258,2022-11-23T17:36:40+01:00,2022-11-23T17:40:58+01:00,Einzelplan 23,,,,,comment,"(Beifall bei der FDP, der SPD und dem BÜNDNIS 90/DIE GRÜNEN)",245.56,258.0,12.439999999999998,neutral,0.002617944497615099,0.007493812125176191,0.9898882508277893
ID206907400,https://de.openparliament.tv/api/v1/media/DE-0200069083,Gesundheit,258,2022-11-23T17:36:40+01:00,2022-11-23T17:40:58+01:00,Einzelplan 23,Katrin Göring-Eckardt,vice-president,,DIE GRÜNEN,speech,Dr. Wolfgang Stefinger ist der nächste Redner für die CDU/CSU-Fraktion.,253.68,258.0,4.319999999999993,neutral,0.000533988990355283,0.0010974834440276027,0.9983685612678528
ID206907400,https://de.openparliament.tv/api/v1/media/DE-0200069083,Gesundheit,258,2022-11-23T17:36:40+01:00,2022-11-23T17:40:58+01:00,Einzelplan 23,,,,,comment,(Beifall bei der CDU/CSU),253.68,258.0,4.319999999999993,neutral,0.004212656989693642,0.02075139805674553,0.9750359654426575
