speech_id,speech_url,speech_keyword,speech_duration,speech_date_start,speech_date_end,speech_agenda_item_title,sentence_speaker,sentence_speaker_status,sentence_speaker_party,sentence_speaker_faction,sentence_type,sentence_text,sentence_time_start,sentence_time_end,sentence_duration,sentence_sentiment_score,sentence_sentiment_positive_weight,sentence_sentiment_negative_weight,sentence_sentiment_neutral_weight
ID204110600,https://de.openparliament.tv/api/v1/media/DE-0200041121,Covid,226,2022-06-02T16:21:45,2022-06-02T16:25:31,Tagesordnungspunkt EPL 30,Christoph Meyer,main-speaker,FDP,FDP,speech,Frau Präsidentin!,1.0,7.28,6.28,positive,0.6170027852058411,0.28104719519615173,0.1019500121474266
ID204110600,https://de.openparliament.tv/api/v1/media/DE-0200041121,Covid,226,2022-06-02T16:21:45,2022-06-02T16:25:31,Tagesordnungspunkt EPL 30,Christoph Meyer,main-speaker,FDP,FDP,speech,Meine sehr geehrten Damen und Herren!,7.28,10.84,3.5599999999999996,negative,0.009883733466267586,0.9672001600265503,0.022916162386536598
ID204110600,https://de.openparliament.tv/api/v1/media/DE-0200041121,Covid,226,2022-06-02T16:21:45,2022-06-02T16:25:31,Tagesordnungspunkt EPL 30,Christoph Meyer,main-speaker,FDP,FDP,speech,"Die Ampelkoalition hat in ihrem Koalitionsvertrag sehr deutlich formuliert, dass Bildung und Forschung für uns Priorität haben.",10.84,17.94,7.100000000000001,neutral,3.827432919933926e-06,5.796312052552821e-06,0.9999903440475464
ID204110600,https://de.openparliament.tv/api/v1/media/DE-0200041121,Covid,226,2022-06-02T16:21:45,2022-06-02T16:25:31,Tagesordnungspunkt EPL 30,Christoph Meyer,main-speaker,FDP,FDP,speech,"Das ist die Grundlage für freie, selbstbestimmte Menschen, für wirtschaftlichen Fortschritt, für technologische Souveränität.",17.94,27.2,9.259999999999998,neutral,3.904917321051471e-06,4.8407696340291295e-06,0.9999912977218628
ID204110600,https://de.openparliament.tv/api/v1/media/DE-0200041121,Covid,226,2022-06-02T16:21:45,2022-06-02T16:25:31,Tagesordnungspunkt EPL 30,Christoph Meyer,main-speaker,FDP,FDP,speech,"Deswegen bin ich froh, dass es uns gelungen ist, trotz der schwierigen Haushaltslage diesen Posten gegenüber dem Regierungsentwurf, den die Große Koalition im letzten Jahr vorgelegt hat, um über 100 Millionen Euro zu steigern und in der mittelfristigen Finanzplanung ebenfalls weitere Mittelaufwüchse zu garantieren und zu sichern.",27.2,48.0,20.8,neutral,0.004139968194067478,0.00572158582508564,0.9901384115219116
ID204110600,https://de.openparliament.tv/api/v1/media/DE-0200041121,Covid,226,2022-06-02T16:21:45,2022-06-02T16:25:31,Tagesordnungspunkt EPL 30,,,,,comment,(Beifall bei der FDP und der SPD sowie bei Abgeordneten des BÜNDNISSES 90/DIE GRÜNEN),27.2,57.0,29.8,neutral,0.0015070255612954497,0.004138133954256773,0.9943548440933228
ID204110600,https://de.openparliament.tv/api/v1/media/DE-0200041121,Covid,226,2022-06-02T16:21:45,2022-06-02T16:25:31,Tagesordnungspunkt EPL 30,Christoph Meyer,main-speaker,FDP,FDP,speech,Wir hatten – das klang eben schon an – sehr konstruktive parlamentarische Beratungen.,48.0,57.0,9.0,neutral,0.0026386557146906853,0.008989987894892693,0.9883713126182556
ID204110600,https://de.openparliament.tv/api/v1/media/DE-0200041121,Covid,226,2022-06-02T16:21:45,2022-06-02T16:25:31,Tagesordnungspunkt EPL 30,Christoph Meyer,main-speaker,FDP,FDP,speech,"Es war die Ampelkoalition, die – besonderen Dank an Wiebke Esdar als Hauptberichterstatterin – sehr moderierend gewirkt hat.",57.0,67.92,10.920000000000002,neutral,2.6869509383686818e-05,6.598137406399474e-05,0.9999071359634399
ID204110600,https://de.openparliament.tv/api/v1/media/DE-0200041121,Covid,226,2022-06-02T16:21:45,2022-06-02T16:25:31,Tagesordnungspunkt EPL 30,Christoph Meyer,main-speaker,FDP,FDP,speech,"Ich möchte aber auch ausdrücklich loben, dass die CDU/CSU zu diesem Einzelplan, in diesen Bereichen – anders als in anderen Bereichen – sehr fleißig Änderungsanträge eingebracht und Initiativen ergriffen hat.",67.92,80.92,13.0,neutral,0.007394272368401289,0.0037879457231611013,0.9888178110122681
ID204110600,https://de.openparliament.tv/api/v1/media/DE-0200041121,Covid,226,2022-06-02T16:21:45,2022-06-02T16:25:31,Tagesordnungspunkt EPL 30,Christoph Meyer,main-speaker,FDP,FDP,speech,Das ist offensichtlich noch nicht selbstverständlich.,80.92,83.8,2.8799999999999955,neutral,0.0019226345466449857,0.00808163546025753,0.9899957180023193
ID204110600,https://de.openparliament.tv/api/v1/media/DE-0200041121,Covid,226,2022-06-02T16:21:45,2022-06-02T16:25:31,Tagesordnungspunkt EPL 30,Christoph Meyer,main-speaker,FDP,FDP,speech,Deswegen sollte sich der eine oder andere vielleicht an Kerstin Radomski ein Beispiel nehmen.,83.8,91.52,7.719999999999999,neutral,1.0178656339121517e-05,2.3430688088410534e-05,0.9999663829803467
ID204110600,https://de.openparliament.tv/api/v1/media/DE-0200041121,Covid,226,2022-06-02T16:21:45,2022-06-02T16:25:31,Tagesordnungspunkt EPL 30,,,,,comment,"(Beifall bei der FDP, der SPD und der CDU/CSU)",83.8,104.28,20.480000000000004,neutral,0.0038508072029799223,0.022443370893597603,0.9737058281898499
ID204110600,https://de.openparliament.tv/api/v1/media/DE-0200041121,Covid,226,2022-06-02T16:21:45,2022-06-02T16:25:31,Tagesordnungspunkt EPL 30,Christoph Meyer,main-speaker,FDP,FDP,speech,"Investitionen, die wir in den parlamentarischen Beratungen noch angeschoben haben, gingen in die Bereiche Digitalisierung, Leistungsfähigkeit des Bildungswesens, Nachwuchsförderung und Wettbewerbsfähigkeit des Wissenschafts- und Innovationssystems.",91.52,104.28,12.760000000000005,neutral,4.351793904788792e-06,5.565222181758145e-06,0.9999901056289673
ID204110600,https://de.openparliament.tv/api/v1/media/DE-0200041121,Covid,226,2022-06-02T16:21:45,2022-06-02T16:25:31,Tagesordnungspunkt EPL 30,Christoph Meyer,main-speaker,FDP,FDP,speech,"Ich freue mich besonders, dass wir im Bereich der Bioökonomie Aufwüchse erzielen konnten.",104.28,108.2,3.9200000000000017,neutral,0.00024793666671030223,0.0004809451929759234,0.9992710947990417
ID204110600,https://de.openparliament.tv/api/v1/media/DE-0200041121,Covid,226,2022-06-02T16:21:45,2022-06-02T16:25:31,Tagesordnungspunkt EPL 30,Christoph Meyer,main-speaker,FDP,FDP,speech,Gerade im Bereich der Nahrungsmittelforschung – das Thema Nahrungsmittelknappheit ist schon angesprochen worden – haben wir unsere eigenen Akzente gesetzt.,108.2,116.44,8.239999999999995,neutral,0.0004463706281967461,0.000681892444845289,0.9988717436790466
ID204110600,https://de.openparliament.tv/api/v1/media/DE-0200041121,Covid,226,2022-06-02T16:21:45,2022-06-02T16:25:31,Tagesordnungspunkt EPL 30,Christoph Meyer,main-speaker,FDP,FDP,speech,Wir sind im Bereich der Post-Covid-/Long-Covid-Forschung und auch im Bereich der mentalen Gesundheit ein Stück weiter gegangen.,116.44,125.24,8.799999999999997,neutral,6.200088591867825e-06,8.28657630336238e-06,0.9999854564666748
ID204110600,https://de.openparliament.tv/api/v1/media/DE-0200041121,Covid,226,2022-06-02T16:21:45,2022-06-02T16:25:31,Tagesordnungspunkt EPL 30,Christoph Meyer,main-speaker,FDP,FDP,speech,"Was hier zum Thema Kernfusion formuliert wurde, kann ich so nicht stehen lassen.",125.24,129.72,4.480000000000004,neutral,0.0052103945054113865,0.014326400123536587,0.9804632067680359
ID204110600,https://de.openparliament.tv/api/v1/media/DE-0200041121,Covid,226,2022-06-02T16:21:45,2022-06-02T16:25:31,Tagesordnungspunkt EPL 30,Christoph Meyer,main-speaker,FDP,FDP,speech,"Wir haben mit ITER ein Projekt, das nicht direkt aus dem nationalen Etat finanziert wird, sondern über die europäische Ebene.",129.72,139.04,9.319999999999993,neutral,3.0972110835136846e-05,3.197807745891623e-05,0.9999370574951172
ID204110600,https://de.openparliament.tv/api/v1/media/DE-0200041121,Covid,226,2022-06-02T16:21:45,2022-06-02T16:25:31,Tagesordnungspunkt EPL 30,Christoph Meyer,main-speaker,FDP,FDP,speech,"Dennoch ist Deutschland mittelbar beteiligt, und das wird natürlich eine der Schlüsseltechnologien sein, auf die wir in Zukunft setzen müssen.",139.04,148.28,9.240000000000009,neutral,7.495708814531099e-06,1.5423129298142157e-05,0.9999771118164062
ID204110600,https://de.openparliament.tv/api/v1/media/DE-0200041121,Covid,226,2022-06-02T16:21:45,2022-06-02T16:25:31,Tagesordnungspunkt EPL 30,,,,,comment,(Beifall bei der FDP),139.04,152.5,13.460000000000008,negative,0.00858994759619236,0.939540684223175,0.05186935514211655
ID204110600,https://de.openparliament.tv/api/v1/media/DE-0200041121,Covid,226,2022-06-02T16:21:45,2022-06-02T16:25:31,Tagesordnungspunkt EPL 30,Yvonne Magwas,vice-president,CDU,CDU/CSU,speech,Erlauben Sie eine Zwischenfrage des Kollegen Jarzombek?,148.28,152.5,4.219999999999999,neutral,2.2797783458372578e-05,5.041276017436758e-05,0.9999268054962158
ID204110600,https://de.openparliament.tv/api/v1/media/DE-0200041121,Covid,226,2022-06-02T16:21:45,2022-06-02T16:25:31,Tagesordnungspunkt EPL 30,Christoph Meyer,main-speaker,FDP,FDP,speech,Ach nein.,152.5,153.7,1.1999999999999886,negative,0.025892900303006172,0.9729271531105042,0.001180010847747326
ID204110600,https://de.openparliament.tv/api/v1/media/DE-0200041121,Covid,226,2022-06-02T16:21:45,2022-06-02T16:25:31,Tagesordnungspunkt EPL 30,Christoph Meyer,main-speaker,FDP,FDP,speech,"Sie sind doch nachher selbst noch dran, Herr Kollege.",153.7,158.48,4.780000000000001,neutral,1.6548608982702717e-05,5.1865121349692345e-05,0.9999315738677979
ID204110600,https://de.openparliament.tv/api/v1/media/DE-0200041121,Covid,226,2022-06-02T16:21:45,2022-06-02T16:25:31,Tagesordnungspunkt EPL 30,,,,,comment,(Thomas Jarzombek [CDU/CSU]: Das ist aber nicht sehr souverän!),153.7,162.24,8.54000000000002,neutral,0.0013346545165404677,0.0053039425984025,0.9933613538742065
ID204110600,https://de.openparliament.tv/api/v1/media/DE-0200041121,Covid,226,2022-06-02T16:21:45,2022-06-02T16:25:31,Tagesordnungspunkt EPL 30,Yvonne Magwas,vice-president,CDU,CDU/CSU,speech,Dann fahren Sie mit der Rede fort.,158.48,162.24,3.7600000000000193,neutral,3.278420990682207e-06,6.7967789618705865e-06,0.9999898672103882
ID204110600,https://de.openparliament.tv/api/v1/media/DE-0200041121,Covid,226,2022-06-02T16:21:45,2022-06-02T16:25:31,Tagesordnungspunkt EPL 30,Christoph Meyer,main-speaker,FDP,FDP,speech,"Wir haben in diesem Etat einen klaren Fokus auf junge Menschen, wir haben auf neue Technologien gesetzt, und wir haben – das wurde auch schon angesprochen – neue Konzepte von Transferwissenschaft in der Anwendung mit der DATI und mit anderen Projekten.",162.24,175.64,13.399999999999977,neutral,9.00524464668706e-05,0.00010877419845201075,0.9998012185096741
ID204110600,https://de.openparliament.tv/api/v1/media/DE-0200041121,Covid,226,2022-06-02T16:21:45,2022-06-02T16:25:31,Tagesordnungspunkt EPL 30,Christoph Meyer,main-speaker,FDP,FDP,speech,"Ich finde, es ist eine Frage der Souveränität des Parlamentes, dass man mit dem Ministerium zusammen auch haushalterische Vermerke wie eine Sperre anbringt.",175.64,185.88,10.240000000000009,neutral,0.0012487253407016397,0.0026834241580218077,0.9960678815841675
ID204110600,https://de.openparliament.tv/api/v1/media/DE-0200041121,Covid,226,2022-06-02T16:21:45,2022-06-02T16:25:31,Tagesordnungspunkt EPL 30,Christoph Meyer,main-speaker,FDP,FDP,speech,Deswegen werden wir uns die entsprechenden Projekte angucken und dann sicherlich zügig – davon bin ich überzeugt – zu einer Entsperrung kommen.,185.88,192.96,7.0800000000000125,neutral,0.029793744906783104,0.01617620885372162,0.9540300965309143
ID204110600,https://de.openparliament.tv/api/v1/media/DE-0200041121,Covid,226,2022-06-02T16:21:45,2022-06-02T16:25:31,Tagesordnungspunkt EPL 30,Christoph Meyer,main-speaker,FDP,FDP,speech,"Uns ist es gelungen, die „Polarstern II“ zu finanzieren – auch eine Aufgabe, die die Vorgängerin der Ministerin nicht geschafft hat –, sodass wir alles in allem –",192.96,206.12,13.159999999999997,positive,0.6526114344596863,0.06565441936254501,0.2817341387271881
ID204110600,https://de.openparliament.tv/api/v1/media/DE-0200041121,Covid,226,2022-06-02T16:21:45,2022-06-02T16:25:31,Tagesordnungspunkt EPL 30,,,,,comment,"(Beifall bei der FDP, der SPD und dem BÜNDNIS 90/DIE GRÜNEN)",192.96,207.08,14.120000000000005,neutral,0.002617944497615099,0.007493812125176191,0.9898882508277893
ID204110600,https://de.openparliament.tv/api/v1/media/DE-0200041121,Covid,226,2022-06-02T16:21:45,2022-06-02T16:25:31,Tagesordnungspunkt EPL 30,Yvonne Magwas,vice-president,CDU,CDU/CSU,speech,Kommen Sie bitte zum Schluss.,206.12,207.08,0.960000000000008,negative,0.01695168763399124,0.905201256275177,0.07784707844257355
ID204110600,https://de.openparliament.tv/api/v1/media/DE-0200041121,Covid,226,2022-06-02T16:21:45,2022-06-02T16:25:31,Tagesordnungspunkt EPL 30,Christoph Meyer,main-speaker,FDP,FDP,speech,– einen guten Haushaltsentwurf noch besser gemacht haben.,207.08,210.16,3.079999999999984,neutral,0.3486325442790985,0.08487934619188309,0.5664880871772766
ID204110600,https://de.openparliament.tv/api/v1/media/DE-0200041121,Covid,226,2022-06-02T16:21:45,2022-06-02T16:25:31,Tagesordnungspunkt EPL 30,Christoph Meyer,main-speaker,FDP,FDP,speech,Deswegen werden wir mit Freude zustimmen und freuen uns auf den Haushalt 2023.,210.16,215.16,5.0,neutral,0.004045335575938225,0.004452658351510763,0.991502046585083
ID204110600,https://de.openparliament.tv/api/v1/media/DE-0200041121,Covid,226,2022-06-02T16:21:45,2022-06-02T16:25:31,Tagesordnungspunkt EPL 30,Christoph Meyer,main-speaker,FDP,FDP,speech,Danke.,215.16,220.76,5.599999999999994,positive,0.9502186179161072,0.03704898804426193,0.012732347473502159
ID204110600,https://de.openparliament.tv/api/v1/media/DE-0200041121,Covid,226,2022-06-02T16:21:45,2022-06-02T16:25:31,Tagesordnungspunkt EPL 30,,,,,comment,"(Beifall bei der FDP, der SPD und dem BÜNDNIS 90/DIE GRÜNEN – Marianne Schieder [SPD]: Das ist ein guter Plan!)",215.16,226.0,10.840000000000003,positive,0.5179030299186707,0.0900217667222023,0.39207521080970764
ID204110600,https://de.openparliament.tv/api/v1/media/DE-0200041121,Covid,226,2022-06-02T16:21:45,2022-06-02T16:25:31,Tagesordnungspunkt EPL 30,Yvonne Magwas,vice-president,CDU,CDU/CSU,speech,"Der nächste Redner der Debatte: Dr. Götz Frömming, AfD- Fraktion.",220.76,226.0,5.240000000000009,neutral,0.000966476509347558,0.0025084323715418577,0.9965251088142395
ID204110600,https://de.openparliament.tv/api/v1/media/DE-0200041121,Covid,226,2022-06-02T16:21:45,2022-06-02T16:25:31,Tagesordnungspunkt EPL 30,,,,,comment,(Beifall bei der AfD),220.76,226.0,5.240000000000009,negative,0.005712344776839018,0.9827818274497986,0.011505898088216782
