speech_id,speech_url,speech_keyword,speech_duration,speech_date_start,speech_date_end,speech_agenda_item_title,sentence_speaker,sentence_speaker_status,sentence_speaker_party,sentence_speaker_faction,sentence_type,sentence_text,sentence_time_start,sentence_time_end,sentence_duration,sentence_sentiment_score,sentence_sentiment_positive_weight,sentence_sentiment_negative_weight,sentence_sentiment_neutral_weight
ID207704500,https://de.openparliament.tv/api/v1/media/DE-0200077053,Covid,219,2022-12-16T12:28:51+01:00,2022-12-16T12:32:30+01:00,Zusatzpunkt 13,Linda Heitmann,main-speaker,GRÜNE,DIE GRÜNEN,speech,Frau Präsidentin!,1.0,12.0,11.0,positive,0.6170027852058411,0.28104719519615173,0.1019500121474266
ID207704500,https://de.openparliament.tv/api/v1/media/DE-0200077053,Covid,219,2022-12-16T12:28:51+01:00,2022-12-16T12:32:30+01:00,Zusatzpunkt 13,Linda Heitmann,main-speaker,GRÜNE,DIE GRÜNEN,speech,Liebe Kolleginnen und Kollegen der demokratischen Fraktionen und liebe AfD-Fraktion!,12.0,17.8,5.800000000000001,neutral,0.001756237237714231,0.003450647694990039,0.9947931170463562
ID207704500,https://de.openparliament.tv/api/v1/media/DE-0200077053,Covid,219,2022-12-16T12:28:51+01:00,2022-12-16T12:32:30+01:00,Zusatzpunkt 13,Linda Heitmann,main-speaker,GRÜNE,DIE GRÜNEN,speech,"Als ich mir Ihren Antrag durchgelesen habe, hatte ich ein Déjà-vu der ungefähr 30 letzten Sitzungen des Gesundheitsausschusses.",17.8,28.68,10.879999999999999,neutral,0.0007018835749477148,0.0023561306297779083,0.9969419836997986
ID207704500,https://de.openparliament.tv/api/v1/media/DE-0200077053,Covid,219,2022-12-16T12:28:51+01:00,2022-12-16T12:32:30+01:00,Zusatzpunkt 13,Linda Heitmann,main-speaker,GRÜNE,DIE GRÜNEN,speech,Regelmäßig zitieren Sie einzelne Studien aus der medizinischen Forschung.,28.68,34.08,5.399999999999999,neutral,4.185834768577479e-06,5.457264705910347e-06,0.9999903440475464
ID207704500,https://de.openparliament.tv/api/v1/media/DE-0200077053,Covid,219,2022-12-16T12:28:51+01:00,2022-12-16T12:32:30+01:00,Zusatzpunkt 13,Linda Heitmann,main-speaker,GRÜNE,DIE GRÜNEN,speech,"Sie picken sich Einzelaspekte heraus,",34.08,36.84,2.760000000000005,neutral,4.448470008355798e-06,6.949004728085129e-06,0.9999885559082031
ID207704500,https://de.openparliament.tv/api/v1/media/DE-0200077053,Covid,219,2022-12-16T12:28:51+01:00,2022-12-16T12:32:30+01:00,Zusatzpunkt 13,,,,,comment,(Zuruf der Abg. Dr. Christina Baum [AfD]),34.08,43.16,9.079999999999998,neutral,0.0215238556265831,0.06095006316900253,0.9175260663032532
ID207704500,https://de.openparliament.tv/api/v1/media/DE-0200077053,Covid,219,2022-12-16T12:28:51+01:00,2022-12-16T12:32:30+01:00,Zusatzpunkt 13,Linda Heitmann,main-speaker,GRÜNE,DIE GRÜNEN,speech,"bringen Ihre eigene Interpretation hinein und versuchen dann, das Ganze zu skandalisieren.",36.84,43.16,6.319999999999993,neutral,1.892778709589038e-05,5.6057600886560977e-05,0.9999250173568726
ID207704500,https://de.openparliament.tv/api/v1/media/DE-0200077053,Covid,219,2022-12-16T12:28:51+01:00,2022-12-16T12:32:30+01:00,Zusatzpunkt 13,Linda Heitmann,main-speaker,GRÜNE,DIE GRÜNEN,speech,"Der Parlamentarische Staatssekretär hat es vorletzte Sitzung ziemlich gut auf den Punkt gebracht, als er sagte: Eine einzelne Studie bringt uns in der Medizin selten echte Erkenntnisse.",43.16,56.12,12.96,neutral,0.0003445451147854328,0.0011523363646119833,0.9985030889511108
ID207704500,https://de.openparliament.tv/api/v1/media/DE-0200077053,Covid,219,2022-12-16T12:28:51+01:00,2022-12-16T12:32:30+01:00,Zusatzpunkt 13,Linda Heitmann,main-speaker,GRÜNE,DIE GRÜNEN,speech,"Man braucht mehrere, die man miteinander in Beziehung setzt, und erst dann kommt man in der Forschung wirklich weiter.",56.12,62.24,6.1200000000000045,neutral,0.001301910961046815,0.002346114255487919,0.996351957321167
ID207704500,https://de.openparliament.tv/api/v1/media/DE-0200077053,Covid,219,2022-12-16T12:28:51+01:00,2022-12-16T12:32:30+01:00,Zusatzpunkt 13,Linda Heitmann,main-speaker,GRÜNE,DIE GRÜNEN,speech,"– Aber mehrere Dinge wirklich sinnvoll miteinander in Beziehung zu setzen, das ist von Ihnen offenbar zu viel verlangt.",62.24,72.72,10.479999999999997,neutral,0.0003126900119241327,0.0008150027133524418,0.9988723397254944
ID207704500,https://de.openparliament.tv/api/v1/media/DE-0200077053,Covid,219,2022-12-16T12:28:51+01:00,2022-12-16T12:32:30+01:00,Zusatzpunkt 13,,,,,comment,(Beifall beim BÜNDNIS 90/DIE GRÜNEN und bei der SPD sowie bei Abgeordneten der FDP und der Abg. Kathrin Vogler [DIE LINKE]),62.24,91.92,29.68,neutral,0.0011614048853516579,0.0027953176759183407,0.99604332447052
ID207704500,https://de.openparliament.tv/api/v1/media/DE-0200077053,Covid,219,2022-12-16T12:28:51+01:00,2022-12-16T12:32:30+01:00,Zusatzpunkt 13,Linda Heitmann,main-speaker,GRÜNE,DIE GRÜNEN,speech,"Was die medizinische Forschung angeht – Frau Baradari hat es schon betont –: Es ist einfach nicht unsere Aufgabe als Politik, Nebenwirkungen von Impfstoffen oder Medikamenten zu erforschen, und es ist auch nicht unsere Aufgabe als Politik, über deren Zulassung oder Empfehlung zu entscheiden.",72.72,91.92,19.200000000000003,neutral,0.00013189449964556843,0.00037940777838230133,0.9994887113571167
ID207704500,https://de.openparliament.tv/api/v1/media/DE-0200077053,Covid,219,2022-12-16T12:28:51+01:00,2022-12-16T12:32:30+01:00,Zusatzpunkt 13,Linda Heitmann,main-speaker,GRÜNE,DIE GRÜNEN,speech,"Darüber, dass das nicht unsere Aufgabe als Politik ist, bin ich offen gestanden auch sehr froh.",91.92,99.76,7.840000000000003,neutral,0.007232364267110825,0.02134920470416546,0.9714184403419495
ID207704500,https://de.openparliament.tv/api/v1/media/DE-0200077053,Covid,219,2022-12-16T12:28:51+01:00,2022-12-16T12:32:30+01:00,Zusatzpunkt 13,,,,,comment,(Beifall beim BÜNDNIS 90/DIE GRÜNEN sowie bei Abgeordneten der SPD und der FDP – Dr. Christina Baum [AfD]: Das kann ich mir gut vorstellen!),91.92,126.44,34.519999999999996,positive,0.8152667880058289,0.14084972441196442,0.043883394449949265
ID207704500,https://de.openparliament.tv/api/v1/media/DE-0200077053,Covid,219,2022-12-16T12:28:51+01:00,2022-12-16T12:32:30+01:00,Zusatzpunkt 13,Linda Heitmann,main-speaker,GRÜNE,DIE GRÜNEN,speech,"Aber es ist unsere Aufgabe als Politik, den Gesundheitszustand unserer Bevölkerung gut im Auge zu behalten und entsprechend darüber zu entscheiden, welche erforschten und zugelassenen Medikamente und Therapien möglicherweise Sinn machen und wo man vielleicht auch noch mehr Geld in Forschung und Entwicklung stecken sollte, um wirklich zu guten Ergebnissen zu kommen.",99.76,126.44,26.679999999999993,neutral,0.00047649265616200864,0.0008824539836496115,0.9986410737037659
ID207704500,https://de.openparliament.tv/api/v1/media/DE-0200077053,Covid,219,2022-12-16T12:28:51+01:00,2022-12-16T12:32:30+01:00,Zusatzpunkt 13,Linda Heitmann,main-speaker,GRÜNE,DIE GRÜNEN,speech,"Deshalb haben wir im letzten Haushalt speziell auch noch mal Geld in die Forschung für Therapien gegen Long Covid gesteckt, und das finde ich einen sehr wichtigen Aspekt in dieser Debatte.",126.44,139.76,13.319999999999993,neutral,0.0006519540911540389,0.0008927282760851085,0.998455286026001
ID207704500,https://de.openparliament.tv/api/v1/media/DE-0200077053,Covid,219,2022-12-16T12:28:51+01:00,2022-12-16T12:32:30+01:00,Zusatzpunkt 13,,,,,comment,(Beifall beim BÜNDNIS 90/DIE GRÜNEN sowie bei Abgeordneten der SPD und der FDP),126.44,149.8,23.360000000000014,neutral,0.0019407635554671288,0.0051304856315255165,0.9929288029670715
ID207704500,https://de.openparliament.tv/api/v1/media/DE-0200077053,Covid,219,2022-12-16T12:28:51+01:00,2022-12-16T12:32:30+01:00,Zusatzpunkt 13,Linda Heitmann,main-speaker,GRÜNE,DIE GRÜNEN,speech,"Was wir wirklich wissen, ist, dass die Impfung das Risiko, an Long Covid zu erkranken, nachgewiesenermaßen senkt.",139.76,149.8,10.04000000000002,neutral,9.430371392227244e-06,2.1044921595603228e-05,0.999969482421875
ID207704500,https://de.openparliament.tv/api/v1/media/DE-0200077053,Covid,219,2022-12-16T12:28:51+01:00,2022-12-16T12:32:30+01:00,Zusatzpunkt 13,,,,,comment,(Dr. Christina Baum [AfD]: Falsch!),139.76,159.6,19.840000000000003,neutral,0.021871577948331833,0.0695219486951828,0.9086065292358398
ID207704500,https://de.openparliament.tv/api/v1/media/DE-0200077053,Covid,219,2022-12-16T12:28:51+01:00,2022-12-16T12:32:30+01:00,Zusatzpunkt 13,Linda Heitmann,main-speaker,GRÜNE,DIE GRÜNEN,speech,"Aber wir stehen in der Forschung, was die Behandlung dieses Erkrankungsbildes und auch die Diagnostik angeht, leider noch am Anfang.",149.8,159.6,9.799999999999983,neutral,3.590264668673626e-06,5.650261755363317e-06,0.999990701675415
ID207704500,https://de.openparliament.tv/api/v1/media/DE-0200077053,Covid,219,2022-12-16T12:28:51+01:00,2022-12-16T12:32:30+01:00,Zusatzpunkt 13,Linda Heitmann,main-speaker,GRÜNE,DIE GRÜNEN,speech,Da müssen wir noch viel besser werden.,159.6,161.84,2.240000000000009,negative,0.009509346447885036,0.9899360537528992,0.0005546837346628308
ID207704500,https://de.openparliament.tv/api/v1/media/DE-0200077053,Covid,219,2022-12-16T12:28:51+01:00,2022-12-16T12:32:30+01:00,Zusatzpunkt 13,Linda Heitmann,main-speaker,GRÜNE,DIE GRÜNEN,speech,"Aber ja, es ist ein Problem.",161.84,164.16,2.319999999999993,neutral,0.013340101577341557,0.04325684532523155,0.9434030652046204
ID207704500,https://de.openparliament.tv/api/v1/media/DE-0200077053,Covid,219,2022-12-16T12:28:51+01:00,2022-12-16T12:32:30+01:00,Zusatzpunkt 13,Linda Heitmann,main-speaker,GRÜNE,DIE GRÜNEN,speech,Die Techniker Krankenkasse hat ihre Zahlen 2020 und 2021 ausgewertet.,164.16,170.44,6.280000000000001,neutral,3.7750423871329986e-06,7.85964493843494e-06,0.999988317489624
ID207704500,https://de.openparliament.tv/api/v1/media/DE-0200077053,Covid,219,2022-12-16T12:28:51+01:00,2022-12-16T12:32:30+01:00,Zusatzpunkt 13,Linda Heitmann,main-speaker,GRÜNE,DIE GRÜNEN,speech,"1 Prozent ihrer Versicherten waren in diesem Zeitraum mit der Diagnose „Long Covid“ ausgefallen, und zwar im Schnitt für 83 Tage.",170.44,180.52,10.080000000000013,neutral,3.4943689115607413e-06,5.0968455980182625e-06,0.9999914169311523
ID207704500,https://de.openparliament.tv/api/v1/media/DE-0200077053,Covid,219,2022-12-16T12:28:51+01:00,2022-12-16T12:32:30+01:00,Zusatzpunkt 13,Linda Heitmann,main-speaker,GRÜNE,DIE GRÜNEN,speech,"Ich finde, das muss uns wirklich zeigen: Wir müssen hier mehr forschen, wie wir dieser Krankheit wirksam begegnen können, und wir müssen hier die Versorgung für die Betroffenen wirklich dringend verbessern.",180.52,193.12,12.599999999999994,negative,0.0395708866417408,0.699449896812439,0.26097917556762695
ID207704500,https://de.openparliament.tv/api/v1/media/DE-0200077053,Covid,219,2022-12-16T12:28:51+01:00,2022-12-16T12:32:30+01:00,Zusatzpunkt 13,Linda Heitmann,main-speaker,GRÜNE,DIE GRÜNEN,speech,"Deshalb: Hören Sie bitte auf mit Ihrem billigen Populismus, und arbeiten Sie mit uns gemeinsam konstruktiv daran, Wege zu finden, wie wir die Versorgung und die Forschung im Bereich von Long Covid wirklich voranbringen, um hier sinnvoll etwas zu bewegen!",193.12,210.16,17.039999999999992,neutral,0.0005464113201014698,0.0013420493341982365,0.9981114864349365
ID207704500,https://de.openparliament.tv/api/v1/media/DE-0200077053,Covid,219,2022-12-16T12:28:51+01:00,2022-12-16T12:32:30+01:00,Zusatzpunkt 13,Linda Heitmann,main-speaker,GRÜNE,DIE GRÜNEN,speech,Vielen Dank.,210.16,211.16,1.0,positive,0.9232267141342163,0.04290890693664551,0.03386438265442848
ID207704500,https://de.openparliament.tv/api/v1/media/DE-0200077053,Covid,219,2022-12-16T12:28:51+01:00,2022-12-16T12:32:30+01:00,Zusatzpunkt 13,,,,,comment,(Beifall beim BÜNDNIS 90/DIE GRÜNEN sowie bei Abgeordneten der SPD und der FDP),210.16,219.0,8.840000000000003,neutral,0.0019407635554671288,0.0051304856315255165,0.9929288029670715
ID207704500,https://de.openparliament.tv/api/v1/media/DE-0200077053,Covid,219,2022-12-16T12:28:51+01:00,2022-12-16T12:32:30+01:00,Zusatzpunkt 13,Aydan Özoğuz,vice-president,SPD,SPD,speech,Abschließend erhält das Wort Erwin Rüddel für die CDU/CSU-Fraktion.,211.16,219.0,7.840000000000003,neutral,3.555563353074831e-06,5.984677500237012e-06,0.9999904632568359
ID207704500,https://de.openparliament.tv/api/v1/media/DE-0200077053,Covid,219,2022-12-16T12:28:51+01:00,2022-12-16T12:32:30+01:00,Zusatzpunkt 13,,,,,comment,(Beifall bei der CDU/CSU),211.16,219.0,7.840000000000003,neutral,0.004212656989693642,0.02075139805674553,0.9750359654426575
