speech_id,speech_url,speech_keyword,speech_duration,speech_date_start,speech_date_end,speech_agenda_item_title,sentence_speaker,sentence_speaker_status,sentence_speaker_party,sentence_speaker_faction,sentence_type,sentence_text,sentence_time_start,sentence_time_end,sentence_duration,sentence_sentiment_score,sentence_sentiment_positive_weight,sentence_sentiment_negative_weight,sentence_sentiment_neutral_weight
ID202109300,https://de.openparliament.tv/api/v1/media/DE-0200021122,Budget,400,2022-03-17T17:23:24,2022-03-17T17:30:04,Tagesordnungspunkt 12,Wilfried Oellers,main-speaker,CDU,CDU/CSU,speech,Sehr geehrte Frau Präsidentin!,1.0,1.6,0.6000000000000001,negative,0.019231420010328293,0.9692500233650208,0.011518583633005619
ID202109300,https://de.openparliament.tv/api/v1/media/DE-0200021122,Budget,400,2022-03-17T17:23:24,2022-03-17T17:30:04,Tagesordnungspunkt 12,Wilfried Oellers,main-speaker,CDU,CDU/CSU,speech,Liebe Kolleginnen und Kollegen!,1.6,2.88,1.2799999999999998,positive,0.946783721446991,0.03850653022527695,0.014709698036313057
ID202109300,https://de.openparliament.tv/api/v1/media/DE-0200021122,Budget,400,2022-03-17T17:23:24,2022-03-17T17:30:04,Tagesordnungspunkt 12,Wilfried Oellers,main-speaker,CDU,CDU/CSU,speech,Meine sehr geehrten Damen und Herren!,2.88,14.64,11.760000000000002,negative,0.009883733466267586,0.9672001600265503,0.022916162386536598
ID202109300,https://de.openparliament.tv/api/v1/media/DE-0200021122,Budget,400,2022-03-17T17:23:24,2022-03-17T17:30:04,Tagesordnungspunkt 12,Wilfried Oellers,main-speaker,CDU,CDU/CSU,speech,"In Anbetracht des Ukrainekrieges ist es sicherlich nicht leicht, über andere Themen zu diskutieren.",14.64,21.68,7.039999999999999,neutral,6.23625692242058e-06,1.300803978665499e-05,0.9999808073043823
ID202109300,https://de.openparliament.tv/api/v1/media/DE-0200021122,Budget,400,2022-03-17T17:23:24,2022-03-17T17:30:04,Tagesordnungspunkt 12,Wilfried Oellers,main-speaker,CDU,CDU/CSU,speech,"Deswegen bin ich umso dankbarer, dass wir heute über die Teilhabe von behinderten Menschen am Arbeitsleben diskutieren und debattieren können.",21.68,30.5,8.82,neutral,0.00014500452380161732,0.0002045246510533616,0.9996504783630371
ID202109300,https://de.openparliament.tv/api/v1/media/DE-0200021122,Budget,400,2022-03-17T17:23:24,2022-03-17T17:30:04,Tagesordnungspunkt 12,,,,,comment,(Takis Mehmet Ali [SPD]: Menschen mit Behinderung!),21.68,49.6,27.92,negative,0.008263636380434036,0.9873786568641663,0.004357644356787205
ID202109300,https://de.openparliament.tv/api/v1/media/DE-0200021122,Budget,400,2022-03-17T17:23:24,2022-03-17T17:30:04,Tagesordnungspunkt 12,Wilfried Oellers,main-speaker,CDU,CDU/CSU,speech,"Meine sehr geehrten Damen und Herren, was haben der barrierefreie Umbau von Fahrzeugen, ein Cateringservice für Kitas, Kinderholzspielzeug, Kaffeegeschirr oder eine Softwarelösung für ein Abrechnungssystem in einem mittelständischen Unternehmen gemeinsam?",30.5,49.6,19.1,neutral,0.004373610485345125,0.01474255695939064,0.9808838367462158
ID202109300,https://de.openparliament.tv/api/v1/media/DE-0200021122,Budget,400,2022-03-17T17:23:24,2022-03-17T17:30:04,Tagesordnungspunkt 12,Wilfried Oellers,main-speaker,CDU,CDU/CSU,speech,Alle diese Produkte und Dienstleistungen wären nicht denkbar ohne die Arbeit von Menschen mit Behinderung und ihre Tätigkeit in Werkstätten für behinderte Menschen oder in Inklusionsunternehmen und Unternehmen auf dem ersten Arbeitsmarkt.,49.6,64.76,15.160000000000004,neutral,6.765318630641559e-06,1.267635070689721e-05,0.9999805688858032
ID202109300,https://de.openparliament.tv/api/v1/media/DE-0200021122,Budget,400,2022-03-17T17:23:24,2022-03-17T17:30:04,Tagesordnungspunkt 12,Wilfried Oellers,main-speaker,CDU,CDU/CSU,speech,"Es muss ja nicht unbedingt gleich das DAX-Unternehmen SAP sein, das seit vielen Jahren Vorreiter bei der Beschäftigung von Menschen mit Behinderung, vor allen Dingen mit Autismus-Syndrom, ist.",64.76,76.92,12.159999999999997,neutral,0.0015047126216813922,0.006356154102832079,0.9921391606330872
ID202109300,https://de.openparliament.tv/api/v1/media/DE-0200021122,Budget,400,2022-03-17T17:23:24,2022-03-17T17:30:04,Tagesordnungspunkt 12,Wilfried Oellers,main-speaker,CDU,CDU/CSU,speech,"Es kann auch ein Kleinunternehmen sein, wie zum Beispiel ein Autohaus aus meinem Wahlkreis, das Fahrzeuge umbaut in einen barrierefreien Zustand für Menschen mit Behinderung.",76.92,88.84,11.920000000000002,neutral,0.0013464702060446143,0.004602168686687946,0.9940513968467712
ID202109300,https://de.openparliament.tv/api/v1/media/DE-0200021122,Budget,400,2022-03-17T17:23:24,2022-03-17T17:30:04,Tagesordnungspunkt 12,,,,,comment,(Beifall bei der CDU/CSU),76.92,97.2,20.28,neutral,0.004212656989693642,0.02075139805674553,0.9750359654426575
ID202109300,https://de.openparliament.tv/api/v1/media/DE-0200021122,Budget,400,2022-03-17T17:23:24,2022-03-17T17:30:04,Tagesordnungspunkt 12,Wilfried Oellers,main-speaker,CDU,CDU/CSU,speech,"Unser Ziel ist es, möglichst viele Menschen mit Behinderung in den ersten Arbeitsmarkt zu vermitteln.",88.84,97.2,8.36,neutral,0.00013183850387576967,0.0003415172395762056,0.9995266199111938
ID202109300,https://de.openparliament.tv/api/v1/media/DE-0200021122,Budget,400,2022-03-17T17:23:24,2022-03-17T17:30:04,Tagesordnungspunkt 12,Wilfried Oellers,main-speaker,CDU,CDU/CSU,speech,"Denn das Problem ist nicht nur, dass mehr Menschen mit Behinderung arbeitslos sind als Menschen ohne Behinderung, sondern auch, dass sie länger arbeitslos sind.",97.2,107.52,10.319999999999993,neutral,1.7500820831628516e-05,3.442862362135202e-05,0.9999480247497559
ID202109300,https://de.openparliament.tv/api/v1/media/DE-0200021122,Budget,400,2022-03-17T17:23:24,2022-03-17T17:30:04,Tagesordnungspunkt 12,Wilfried Oellers,main-speaker,CDU,CDU/CSU,speech,"Diese Probleme müssen wir angehen und dabei alle Pfeiler des inklusiven Arbeitsmarkts wie Inklusionsbetriebe, Einrichtungen für die berufliche Rehabilitation oder Werkstätten für behinderte Menschen fördern und vor allem die Übergänge zwischen den Einrichtungen hin zum ersten Arbeitsmarkt verbessern.",107.52,127.16,19.64,neutral,2.1929552531219088e-05,4.384641215438023e-05,0.999934196472168
ID202109300,https://de.openparliament.tv/api/v1/media/DE-0200021122,Budget,400,2022-03-17T17:23:24,2022-03-17T17:30:04,Tagesordnungspunkt 12,Wilfried Oellers,main-speaker,CDU,CDU/CSU,speech,Als Regierungsfraktion der letzten Legislaturperioden haben wir hierzu einiges auf den Weg gebracht.,127.16,132.88,5.719999999999999,neutral,0.00031529765692539513,0.0005080761620774865,0.999176561832428
ID202109300,https://de.openparliament.tv/api/v1/media/DE-0200021122,Budget,400,2022-03-17T17:23:24,2022-03-17T17:30:04,Tagesordnungspunkt 12,Wilfried Oellers,main-speaker,CDU,CDU/CSU,speech,"Es ist gut, dass wir mittlerweile einheitliche Ansprechstellen für Unternehmen, für Arbeitgeber haben.",132.88,139.8,6.920000000000016,neutral,0.03488992154598236,0.00556739280000329,0.9595426917076111
ID202109300,https://de.openparliament.tv/api/v1/media/DE-0200021122,Budget,400,2022-03-17T17:23:24,2022-03-17T17:30:04,Tagesordnungspunkt 12,Wilfried Oellers,main-speaker,CDU,CDU/CSU,speech,"Jetzt müssen diese aber in die Fläche gebracht werden, damit sie die Unternehmen auch begleiten können, Menschen mit Behinderung zu beschäftigen.",139.8,151.12,11.319999999999993,neutral,3.800991635216633e-06,4.892779543297365e-06,0.9999912977218628
ID202109300,https://de.openparliament.tv/api/v1/media/DE-0200021122,Budget,400,2022-03-17T17:23:24,2022-03-17T17:30:04,Tagesordnungspunkt 12,Wilfried Oellers,main-speaker,CDU,CDU/CSU,speech,Die BIH hat zur Umsetzung des gesetzlichen Auftrags Handlungsempfehlungen entwickelt.,151.12,157.84,6.719999999999999,neutral,3.288022071501473e-06,5.499032795341918e-06,0.9999911785125732
ID202109300,https://de.openparliament.tv/api/v1/media/DE-0200021122,Budget,400,2022-03-17T17:23:24,2022-03-17T17:30:04,Tagesordnungspunkt 12,Wilfried Oellers,main-speaker,CDU,CDU/CSU,speech,"Aber ich erwarte, dass sich die Bundesregierung hier nicht nur auf die Integrationsämter und ihre Berichterstattung verlässt, sondern auch selbst eine aktive Rolle einnimmt und eine bundesweite Strategie sowie einen zeitlichen Fahrplan entwickelt.",157.84,178.76,20.919999999999987,neutral,1.0208243111264892e-05,1.8189084585173987e-05,0.9999716281890869
ID202109300,https://de.openparliament.tv/api/v1/media/DE-0200021122,Budget,400,2022-03-17T17:23:24,2022-03-17T17:30:04,Tagesordnungspunkt 12,,,,,comment,(Beifall bei der CDU/CSU),157.84,182.2,24.359999999999985,neutral,0.004212656989693642,0.02075139805674553,0.9750359654426575
ID202109300,https://de.openparliament.tv/api/v1/media/DE-0200021122,Budget,400,2022-03-17T17:23:24,2022-03-17T17:30:04,Tagesordnungspunkt 12,Wilfried Oellers,main-speaker,CDU,CDU/CSU,speech,Einen Flickenteppich für Beratungsangebote darf es am Ende nicht geben.,178.76,182.2,3.4399999999999977,neutral,0.0010556993074715137,0.004801682196557522,0.9941425919532776
ID202109300,https://de.openparliament.tv/api/v1/media/DE-0200021122,Budget,400,2022-03-17T17:23:24,2022-03-17T17:30:04,Tagesordnungspunkt 12,Wilfried Oellers,main-speaker,CDU,CDU/CSU,speech,Die über 900 Inklusionsbetriebe leisten einen wichtigen Beitrag als Teil des ersten Arbeitsmarktes und zugleich als Brücke dorthin.,182.2,192.44,10.240000000000009,neutral,3.517607183312066e-06,4.900570274912752e-06,0.9999915361404419
ID202109300,https://de.openparliament.tv/api/v1/media/DE-0200021122,Budget,400,2022-03-17T17:23:24,2022-03-17T17:30:04,Tagesordnungspunkt 12,Wilfried Oellers,main-speaker,CDU,CDU/CSU,speech,Auch unabhängig von der Pandemie benötigen sie aber eine sichere finanzielle Basis.,192.44,197.84,5.400000000000006,neutral,3.5439786643109983e-06,4.997434643883025e-06,0.9999914169311523
ID202109300,https://de.openparliament.tv/api/v1/media/DE-0200021122,Budget,400,2022-03-17T17:23:24,2022-03-17T17:30:04,Tagesordnungspunkt 12,Wilfried Oellers,main-speaker,CDU,CDU/CSU,speech,Der von der Regierungskoalition ab dem 1. Oktober 2022 geplante Mindestlohn von 12 Euro ist auch von den Inklusionsunternehmen zu tragen.,197.84,209.32,11.47999999999999,neutral,3.362171810294967e-06,5.245934062259039e-06,0.9999914169311523
ID202109300,https://de.openparliament.tv/api/v1/media/DE-0200021122,Budget,400,2022-03-17T17:23:24,2022-03-17T17:30:04,Tagesordnungspunkt 12,Wilfried Oellers,main-speaker,CDU,CDU/CSU,speech,Die derzeitigen an die Firmen gewährten Zuwendungen wachsen allerdings nicht automatisch mit.,209.32,215.8,6.480000000000018,neutral,4.043781700602267e-06,6.600665528821992e-06,0.99998939037323
ID202109300,https://de.openparliament.tv/api/v1/media/DE-0200021122,Budget,400,2022-03-17T17:23:24,2022-03-17T17:30:04,Tagesordnungspunkt 12,Wilfried Oellers,main-speaker,CDU,CDU/CSU,speech,Das muss gewährleistet sein.,215.8,217.56,1.759999999999991,neutral,0.0016460813349112868,0.005299877841025591,0.9930540919303894
ID202109300,https://de.openparliament.tv/api/v1/media/DE-0200021122,Budget,400,2022-03-17T17:23:24,2022-03-17T17:30:04,Tagesordnungspunkt 12,Wilfried Oellers,main-speaker,CDU,CDU/CSU,speech,"Ebenso muss auch die Umsatzsteuerthematik, die ja schon länger besteht, geregelt werden.",217.56,223.64,6.079999999999984,neutral,3.667490545922192e-06,6.111659786256496e-06,0.9999902248382568
ID202109300,https://de.openparliament.tv/api/v1/media/DE-0200021122,Budget,400,2022-03-17T17:23:24,2022-03-17T17:30:04,Tagesordnungspunkt 12,Wilfried Oellers,main-speaker,CDU,CDU/CSU,speech,"Es ist auch gut, dass wir vor einigen Jahren das Budget für Arbeit und das Budget für Ausbildung eingeführt haben und gerade auch zuletzt mit dem Teilhabestärkungsgesetz punktuell noch einmal nachgebessert haben.",223.64,236.8,13.160000000000025,positive,0.5802682042121887,0.013830280862748623,0.4059014916419983
ID202109300,https://de.openparliament.tv/api/v1/media/DE-0200021122,Budget,400,2022-03-17T17:23:24,2022-03-17T17:30:04,Tagesordnungspunkt 12,Wilfried Oellers,main-speaker,CDU,CDU/CSU,speech,Doch wir alle wissen: Die Instrumente werden weiterhin viel zu wenig genutzt.,236.8,242.12,5.319999999999993,neutral,0.0004204703727737069,0.0013584170956164598,0.9982210993766785
ID202109300,https://de.openparliament.tv/api/v1/media/DE-0200021122,Budget,400,2022-03-17T17:23:24,2022-03-17T17:30:04,Tagesordnungspunkt 12,Wilfried Oellers,main-speaker,CDU,CDU/CSU,speech,"Wir machen in unserem Antrag Vorschläge, wie man diese wichtige Brücke in den Arbeitsmarkt attraktiver gestalten kann, zum Beispiel durch die Aufhebung der Begrenzung des Lohnkostenzuschusses beim Budget für Arbeit, durch die Erweiterung des Budgets für Ausbildung auf die Inklusionsbetriebe und Einrichtungen der beruflichen Rehabilitation und durch eine Informations- und Schulungskampagne, um diese Instrumente bekannter zu machen.",242.12,269.26,27.139999999999986,neutral,4.902263754047453e-06,4.250683559803292e-06,0.9999908208847046
ID202109300,https://de.openparliament.tv/api/v1/media/DE-0200021122,Budget,400,2022-03-17T17:23:24,2022-03-17T17:30:04,Tagesordnungspunkt 12,Wilfried Oellers,main-speaker,CDU,CDU/CSU,speech,"Doch es wird auch weiterhin Menschen geben, die den Weg aus den Werkstätten hin auf den ersten Arbeitsmarkt nicht schaffen oder auch nicht gehen wollen.",269.26,281.16,11.900000000000034,neutral,5.05522530147573e-06,1.1859987353091128e-05,0.9999830722808838
ID202109300,https://de.openparliament.tv/api/v1/media/DE-0200021122,Budget,400,2022-03-17T17:23:24,2022-03-17T17:30:04,Tagesordnungspunkt 12,Wilfried Oellers,main-speaker,CDU,CDU/CSU,speech,"Diese Menschen brauchen ein Entgelt, das ihre Arbeit würdigt und für die Werkstätten finanzierbar ist.",281.16,288.8,7.639999999999986,neutral,4.626268491847441e-06,8.601564331911504e-06,0.9999867677688599
ID202109300,https://de.openparliament.tv/api/v1/media/DE-0200021122,Budget,400,2022-03-17T17:23:24,2022-03-17T17:30:04,Tagesordnungspunkt 12,Wilfried Oellers,main-speaker,CDU,CDU/CSU,speech,"Gleichzeitig weiß ich aber auch aus vielen Gesprächen mit den Werkstattbeschäftigten, wie wichtig ihnen ist, dass sie ihre Schutzrechte behalten.",288.8,298.08,9.279999999999973,neutral,6.033751105860574e-06,1.0099419341713656e-05,0.9999839067459106
ID202109300,https://de.openparliament.tv/api/v1/media/DE-0200021122,Budget,400,2022-03-17T17:23:24,2022-03-17T17:30:04,Tagesordnungspunkt 12,Wilfried Oellers,main-speaker,CDU,CDU/CSU,speech,"Ich bin gespannt, welche Lösungen das Forschungsvorhaben für das Werkstattentgelt hierzu unterbreiten wird.",298.08,304.88,6.800000000000011,neutral,9.446260810364038e-05,0.00021086132619529963,0.9996947050094604
ID202109300,https://de.openparliament.tv/api/v1/media/DE-0200021122,Budget,400,2022-03-17T17:23:24,2022-03-17T17:30:04,Tagesordnungspunkt 12,Wilfried Oellers,main-speaker,CDU,CDU/CSU,speech,"Wir haben als CDU/CSU-Fraktion bereits in der letzten Legislaturperiode ein Modell auf den Weg gebracht, mit dem zumindest die Problematik der Erhöhung des Grundbetrages für die Werkstattbeschäftigten abgefedert werden kann.",304.88,319.48,14.600000000000023,neutral,3.751964641196537e-06,4.952777544531273e-06,0.9999912977218628
ID202109300,https://de.openparliament.tv/api/v1/media/DE-0200021122,Budget,400,2022-03-17T17:23:24,2022-03-17T17:30:04,Tagesordnungspunkt 12,Wilfried Oellers,main-speaker,CDU,CDU/CSU,speech,"Es ist auch gut, dass sich in der Coronapandemie Berufsbildungswerke, Berufsförderungswerke und Werkstätten für behinderte Menschen auf den Weg gemacht haben, ihre Leistungen auf digitale Angebote umzustellen.",319.48,333.12,13.639999999999986,neutral,9.205152309732512e-06,1.585718746355269e-05,0.9999749660491943
ID202109300,https://de.openparliament.tv/api/v1/media/DE-0200021122,Budget,400,2022-03-17T17:23:24,2022-03-17T17:30:04,Tagesordnungspunkt 12,Wilfried Oellers,main-speaker,CDU,CDU/CSU,speech,"Hier hat sich schnell gezeigt, welchen Mehrwert die Digitalisierung für die Teilhabe von Menschen mit Behinderung hat.",333.12,339.84,6.71999999999997,neutral,8.38140203995863e-06,1.5716193956905045e-05,0.9999759197235107
ID202109300,https://de.openparliament.tv/api/v1/media/DE-0200021122,Budget,400,2022-03-17T17:23:24,2022-03-17T17:30:04,Tagesordnungspunkt 12,Wilfried Oellers,main-speaker,CDU,CDU/CSU,speech,"Doch auch aus dem Austausch mit außerbetrieblichen Bildungseinrichtungen weiß ich, dass man sich dort mehr Unterstützung für die Digitalisierung wünscht.",339.84,348.52,8.680000000000007,neutral,2.615950688777957e-05,5.661175964633003e-05,0.9999172687530518
ID202109300,https://de.openparliament.tv/api/v1/media/DE-0200021122,Budget,400,2022-03-17T17:23:24,2022-03-17T17:30:04,Tagesordnungspunkt 12,Wilfried Oellers,main-speaker,CDU,CDU/CSU,speech,"Als Union teilen wir daher die Meinung, dass wir eine Art DigitalPakt Schule 2.0 benötigen, ein Förderprogramm für barrierefreie digitale Angebote in außerbetrieblichen Bildungseinrichtungen.",348.52,366.56,18.04000000000002,neutral,3.683959221234545e-06,5.196577603783226e-06,0.9999911785125732
ID202109300,https://de.openparliament.tv/api/v1/media/DE-0200021122,Budget,400,2022-03-17T17:23:24,2022-03-17T17:30:04,Tagesordnungspunkt 12,,,,,comment,(Beifall bei der CDU/CSU),348.52,370.76,22.24000000000001,neutral,0.004212656989693642,0.02075139805674553,0.9750359654426575
ID202109300,https://de.openparliament.tv/api/v1/media/DE-0200021122,Budget,400,2022-03-17T17:23:24,2022-03-17T17:30:04,Tagesordnungspunkt 12,Wilfried Oellers,main-speaker,CDU,CDU/CSU,speech,Zusammenfassend: Was also sollte Ziel inklusiver Arbeitsmarktpolitik der nächsten Jahre sein?,366.56,370.76,4.199999999999989,neutral,0.00013002529158256948,0.00036674653529189527,0.9995032548904419
ID202109300,https://de.openparliament.tv/api/v1/media/DE-0200021122,Budget,400,2022-03-17T17:23:24,2022-03-17T17:30:04,Tagesordnungspunkt 12,Wilfried Oellers,main-speaker,CDU,CDU/CSU,speech,"Es bedarf vor allem mehr Kooperation, mehr Ansprache und einer Stärkung der digitalen Teilhabe, um die Potenziale von Beschäftigten mit Behinderung zu nutzen.",370.76,381.36,10.600000000000023,neutral,5.029177373216953e-06,7.072155767673394e-06,0.9999878406524658
ID202109300,https://de.openparliament.tv/api/v1/media/DE-0200021122,Budget,400,2022-03-17T17:23:24,2022-03-17T17:30:04,Tagesordnungspunkt 12,Wilfried Oellers,main-speaker,CDU,CDU/CSU,speech,Hierzu bietet unser Antrag konstruktive Vorschläge.,381.36,384.88,3.519999999999982,neutral,0.0009831758216023445,0.001899450784549117,0.9971174001693726
ID202109300,https://de.openparliament.tv/api/v1/media/DE-0200021122,Budget,400,2022-03-17T17:23:24,2022-03-17T17:30:04,Tagesordnungspunkt 12,Wilfried Oellers,main-speaker,CDU,CDU/CSU,speech,Ich freue mich auf die Beratungen.,384.88,386.48,1.6000000000000227,positive,0.9614967107772827,0.03160130977630615,0.006901944521814585
ID202109300,https://de.openparliament.tv/api/v1/media/DE-0200021122,Budget,400,2022-03-17T17:23:24,2022-03-17T17:30:04,Tagesordnungspunkt 12,Wilfried Oellers,main-speaker,CDU,CDU/CSU,speech,Vielen Dank.,386.48,399.96,13.479999999999961,positive,0.9232267141342163,0.04290890693664551,0.03386438265442848
ID202109300,https://de.openparliament.tv/api/v1/media/DE-0200021122,Budget,400,2022-03-17T17:23:24,2022-03-17T17:30:04,Tagesordnungspunkt 12,,,,,comment,(Beifall bei der CDU/CSU),386.48,399.96,13.479999999999961,neutral,0.004212656989693642,0.02075139805674553,0.9750359654426575
